Headword,Definition
ГРАФИТЬ,"лінаваць, рубрыкаваць, рубкаваць; рубнік, чатырохкантовая лінейка."
ГРАЦА,ж. ням. трызубы крук да ачысткі лех
ГРАЦИЯ,"ж. грэцк. стройнасьць грацыя,"
ГРАЯТЬ,"каркаць, гракаць."
"ГРАЙ, ГРАЙВОРОН","птах Corvus frugilegus; грак, гракі; гракаць, крычаць як грак."
ГРЕЗИТЬ,"Марыць, крозіць, мроіць. Слова — марыць — у значэньні рас. „мечтать“ зайшло да"
ГРЕМЕТЬ,"грымець, грымоты, грымнуць, гром."
ГРЕСТЬ,"грабці, грабнуць, грабаць, граблі, грабок."
ГРЕБНОЙ,"аб вадаплавах; веславы, вёслаўка."
ГРЕБЕНЬ,"прылада з зубьбямі да рожнага ужытку; да часаньня валасоў — грэбень, грабянёк; да часаньня лёну — грабло, грэпель; да часаньня коні грэбліца, скрабніца."
"ГРЕЧА, ГРЕЧИХА","ж. збожавая расьціна Polygonum Fagopyrum; грэчка, грычаны, грычанік."
ГРЕМУШКА,ж. клякотка.
ГРИБ,"м. расьціна якая складаецца з караня або стабура з плёнчыкамі, і шапкі; падысподам шапкі наздрыстая валаскамі мяздра, завецца струткамі; згэтуль усе грыбы, якія маюць над нізом струткі, называюцца струтчакамі, а якія маюць пласткі або, пругі называюцца пружакамі; грыб, грыбок грыбаўе."
ГРИВА,"ж. доўгія валасы на шыі жывёлаў; грыва, грыўка, грывісты, грывач."
ГРИМАСА,"ж. франц. перакрыўленая міна, крыўляне аблічча; ухмылка, выкрыўляньне, крыгаваньнеся. Шнуруецца крыгуецца, да работы-ж лента. Не выкрыўляйся, не крыгуйся перад люстэркам. крывеліцца, вырыўляць міны, пахмыляцца."
ГРИФ,"м. ням. ручка скрыпкі па якой пальцамі левай рукі перабіраюць струны; цэўка, ладаўка."
ГРОБ,"м. скрынка ў якой хаваюць труп чалавека; труна, дамавіна, дамоўка, корст, карстага — гроб калодай."
ГРОБОКОП,"м. той, што капае магілу; магільшчык, грабар."
ГРОБНИЦА,ж. магіла з накопам або помнікам
ГРОГ,"м. англ. ром з вадой; грог, у нас робяць сьпірт з вадой і цукрам, ці мёдам; гарнак."
ГРОЗА,"ж. дождж з громам і сьвігавіцамі; навальніца, бура."
ГРОЗДИЕ,"ср. аб ягадах калі цэлы камок іх на аднэй ветцы; гроздзі, аб арэхах гронкі; аб цыбулі — лукно. Гроздзі вінаграду называюць вінагрозьдзі."
ГРОЗИТЬ,"каму, чым; пужаць, страшыць, адгражацца; гразіць, гразіцца, граза. Ніякай гразы няма, таму дзеці такія разбязураныя. Ен мне пагразіў кулаком. Добра на таго гразіцца, хто пагроз баіцца. Часам гразой, часам лазой. Грозны — страшны, сярдзіты, неміласэрны."
ГРОМАДИНА,ж. аграмадзіна.
ГРОМИТЬ,"граміць, разграміць, разьбіць, разшматаць."
ГРОМ,"м. гром, грымот, грымець, громны, грамавы."
ГРОМКИЙ,"голасны, гучны."
ГРОМОЗДИТЬ,"што, грамоздзіць, грамоздзіцца, грамазда, грамозкі,"
ГРОХНУТЬ,"грымнуць, грымнуцца, гракнуць."
ГРОХОТАТЬ,"гракатаць, грокат, грактаць, гракоча, гракаць, гракатаць, гракатня,"
ГРУБЫЙ,"тоўсты, каструбісты і каляны; грубы, грубасьць, грубіян, грубіць."
ГРУДЬ,"ж. грудзі, грудны."
ГРУЗИТЬ,"што, напаўняць таварам, пакаваць; абцяжаць цягарам — абцяжаць."
ГРУЗОВОЙ,цяжкавы. Аб звозчыку: панараднік.
ГРУЗИЛО,"цягар прывешаны да шнурка каб ацягаць яго на дно вады; тунок, тунцы глінянкі пры сетках."
ГРУМ,"м, англ. конны прыслужнік; гайдук."
ГРУПА,"ж. ням. група, групаваць, групоўка."
ГРУСТЬ,"ж. сум, сумаваць; маркота, маркоціць, маркотны. (гл. грезить)."
ГРУША,"фруктовае дрэва і плод; груша, грушкі. Даўней у нас звалі дуля, дулі."
ГРЫЖА,"прарыў у канцы пах жывата; кіла, папула."
ГРИЗТЬ,"што, грызці, грызун, грызок, агрызак; цяць, пацяты. Мышы пацялі лён."
ГРЕТЬ,"што, грэць, грэцца, грэньне, грэнка грэты на сале хлеб."
ГРЕХ,"м. грэх, грэшны, грэшнік, грашыць, грэшнасьць, грэхаводнік."
ГРЯДА,"падоўжнае ўзвышаньне зямлі; ляха, ляшыць; гранка, граніць; рад гор — горскі хрыбет."
ГРЯДУЩИЙ,"прышлы, будучы."
ГРЯЗЬ,"ж. размоклая зямля; грязь, балота; нячыстасьць — бруд, брудзіць, брудны."
ГУБА,"ж. наросты на дрэвах; губа, гарун, бліца, трут, жагра. Губка, якая мае па над струткамі валакністую тканіну годную да выкрасаньня у яе агня; гарун, нарост на дрэве, які мае зярністае цьвёрдае мязіва, але в. надатнае да выкрасаньня у яго агня; бліца, тонкія наросты на дрэвах грыбамі. Трут і жагар або жагра — адмены дрэўных губак."
ГУБА,"ж. марскі заліў; затон, затока."
ГУБЫ,"ж, мн. вусны."
И вусначки цалаваны. (Ш. т. И. ч. ИИ,стр. 30).
ГУВЕРНЕР,м. франц. даглядчык дзяцей; выхоўнік.
ГУДЕТЬ,"гусьці, гімець. Калі многа камароў, мух разам гудуць, то кажуць: камары, мухі гімяць."
ГУЛЯТЬ,"хадзіць, а часам і ездзіць дзеля разрыўкі; шпацыраваць, прахаджацца, прахаджка."
ГУЛЯНИЕ,"ср, пагуляньне, ігрышча, забава, пагулка, гуляўнік, гуляўка, гуляўшнына."
ГУМАННЫЙ,"м. лац. чалавекалюблівы, міласэрны; людзкі, людзскасьць. Людзкі чалавек. Людзкае абходжаньне, адношаньне."
ГУРТ,"м. ням. стада, гурмо."
ГУСЕНИЦА,"ж. недаразьвіты матыль у постаці чарвячка з ножкамі: вусень, вусініца."
ГУСТОЙ,"м. густы, гусьнець, гуснак, густыш, гусьцець."
ГУСЬ,"гуся ж. гусак, м. гусянё, гусіны, гусячы."
ГУТАПЕРЧА,ж. гумілястыка.
ДА,"прысл, так, але. Так яму і трэба. На праўду мала слоў: або так, або не. Паміж бабскім — так і не — не прапіхнеш іголкі. Але, праўду кажаш! Але, згаджаюся."
ДАБЫ,"каб, абы. Каб тое веданьне наперад. Каб усё добра было. Каб не панская мудрасьць, жыдоўская хітрасьць, а наша сіла, то съвст-бы ня ўстояў. Абы ўсё было добра. Абы толькі ў ладзе ды ў грамадзе."
ДАВАТЬ,"што каму, агульн. слав. даваць, давай, давацца, даваньне, дацьцё, давец, датны."
ДАВЕЧА,"аномадні, анадась, анэды, анагдась."
ДАВИТЬ,"што, душыць, ціснуць, гнясьці, прыгнятаць, клешчыць. Сабака давіцца косьцю, але пятлёй задушыў сабаку, У нас слова давіць, давіцца ужываецца толькі у значэньні затканьня горла: Задушылі чалавека. Птушка задушылася ў пляніцы. Выгняці балячку. Гняце пан людзей, Калясом пагнятло руку. Прыгнятае душу. Клешчыць жалям сэрца."
ДАВЛЕНИЕ,"ср. націск, уціск."
ДАВИЛО,"прыбор да прыцісканьня; да выцісканьня сыроў ужываюць: націсь, цісло, ціскі; да прыцісканьня лёну у сажалках ужываюць намокшых калод, якія называюць: памак адзін. л. памакі, мн. л. У пераносным зн. памак чалавек непаваротлівы, няздарны, лежабок."
ДАВКА,"ж. сьціск, цесната, таўпарня, талачня."
ДАВКОСТЬ,"прым. аб фруктах, бульбе, сыпкіх, сухіх і душачых пры ежы; сопкасьць, сопкі. Сопкая бульба, аж на муку рассыпаецца. Сопкія грушы."
ДАВНО,"прысл, агульн. слав; даўно, даўненька, даўным-даўно, даўнасьць, даўны, даўнейшы, даўніна, даўнюська, даўнюсенька."
ДАЖЕ,"злуч. выражае руб скрайнасьць, да чаго, апошнюю, вышэйшую ступеню; нават, навет, аж. Ен зазлаваў, навет хацеў выйсьці. Нават беднаму нічога ня ўзыча. Аж пад Шаркаўшчынай знашоў. Аж ускочыў з лавы пачуўшы гэта."
ДАКАПО,"прысл. муз. італьян, ізноў, пачынай ізноў."
ДАКАТЬ,"патакаць, такаць, такайла, такала такель, патачнік."
ДАЛЕКИЙ,"агульн. слав. далёкі, далёкасьць, далёка, даль, далечыня, даліць; адлеглы, адлегласьць."
ДАЛЬНОВИДНОСТЬ,празорлівасьць.
ДАМА,франц. жанчына вышэйшай клясы; паня.
ДАМА,у картах; краля.
ДАМБА,"ж. ням, насып валам ад вады, або праз балота; грэбля, капаніца, гаць. Грэблі робяць праз балота кладучы бэлькі і хвораст пад насыпку; капаніцы накапываюць з самой зямлі; гаць азначае тое-ж, што і рас. „запруда“."
ДАНТИСТ,"м. фр. зубны лекар, зубасад, жартаўліва: зубадзёр."
ДАРИТЬ,"каму, што; дарыць, дараваць, падараваць, дарунак."
"ДАРОВАНИЕ, ДАРОВИТОСТЬ","чалавек абдараваны здольнасьцямі; здольнасьць, талент."
ДАРОВОЙ,"дармовы, дарэмны."
ДАРСТВЕННАЯ,замацаваньне падарку на паперы; дарчая.
ДАРСТВЕННЫЙ,дарны.
ДАР,"дар, дарунак, дарэньне."
ДАТЬ ТЯГУ,даць драла.
ДАХА,ж. манг. кажух які апранаюць поўсьцю
ДАЯНИЕ,"— датак, дадзежа. Усякі датак добра,"
ДВА м. ДВЕ,"ж. два, двох, двом; дзьве, дзьвех, дзьвем, дзьвём; пара, цотка, цот; двое, двойчы; двойка, двач, дваяк, даваячыць, дваячыцца, двоміцца, дзьвечны, двочыць, двакрот, двадцаць, дваста."
ДВЕРЬ,"ж, дзьверы, дзьверны, дзьвернік-ніца; вярэі. Вярэямі называюць дзьверы з двох палавін, створак."
ДВИГАТЬ,"што, сунуць, рухаць, кратаць; Пасунь стоўчык да стала. Нешта рухаецца ў пяску. Рух, рухавы, рухавасьць, паруховы, паруховасьць, рухнуць. Кратае пальцамі. Ідзе, ледзь кратаецца. Не магу ні нагой, ні рукой крануць; кратацца, покрацьцю."
ДВИЖЕНИЕ,ср. рух.
ДВИГАТЕЛЬ,"м. руштуг, цягнік."
ДВИЖИМОСТЬ,"рухомасьць, рухмацьцё, рухматло."
ДВОЕ,"ліч. двоя, дваіх, дваім."
ДВОЕБРАЧИЕ,двужэнства.
ДВОЕДУШИЕ,двудушнасьць.
ДВОСМЫСЛЕННЫЙ,двузначны.
ДВОИТСЯ,двоміцца.
ДВОЙНОЙ,"падвойны, двойчаты, дубэльтовы,"
ДВОЙСТВЕННЫЙ,"дваісты, дваістасьць."
ДВОР,"м, мейсца пад жылым домам з прыналежнымі будоўлямі і агародай; сяліба. Двор у нашай мове азначае тое, што па расійску „усадьба“, „поместье“. Дворышча жылы дом для комунальнай, радавітай сямьі. Даўней у нас жылі пераважна дворышчамі, семьямі па 10—50 душ; для гэткіх сямей будавалі вялікія хаты. Цікава адзначыць архітэктонічную асобнасьць дворышч: жылы канец дворышча выяўляў вялікую сьвятліцу са стаўбом пасередзіне які называлі „князем“, „князьком“, „канём“, „турам“; на „каня“, „князя“ зыходзіліся ад чатырох сьцен маціцы і на яго сьпіраліся. Гэткія дворышчы вядомы толькі з архіўных дакумантаў."
ДВОРЕЦ,"м. палац, палацовы, палацовец; арх. хорам."
ДВОРНИК,работнік і вартаўнік пры доме; брамнік.
ДВОРНЯГА,"сабака, кундаль, кундыс."
ДВОР,"агароджаны пляцок каля дому, заценены"
ДВОРЕЦКИЙ,"кіраўнік панскага дому; дамавер, дамарадзкі, дамарад, дамараднік."
ДВОРЯНИН,"м. чалавек які прыналежыць да прывілейнага стану; дваранін, шляхціц."
ДВОЮРОДНЫЙ,"збрат-дзеці; зродны-ная. Зродны брат, сын брата бацькі, або брата маці — дзядзькі, а такжа сястры бацькі, ці сястры маці — цёткі."
ДВУПОЛЫЙ,"двуплосны, ад „плосьць“ — рас. „пол.“."
ДВУБОРТНЫЙ,дубальтоўны.
ДВУСМЫСЛЕНЫЙ,двузначны.
ДВУХСТИШИЕ,двоверш.
ДВУЦВЕТНЫЙ,"двойбарвы, двойколерны."
ДВУЛИЧНЫЙ,двааблічны.
ДВЕНАДЦАТЬ,дванадцаць.
ДВЕСТИ,"дзьвесьце, дваста."
ДЕБЕЛЫЙ,"пухкі, тоўсты, гладкі."
ДЕБЕТ,"тарг. лац. левая, або даходная старана тарговай кнігі; даход."
ДЕБОШИРОВАТЬ,франц. буяніць.
ДЕБРЬ,"ж. густа заросшая лесам даліна; гашча, княя."
ДЕБЮТ,м. франц. першы выхад на сцэну; выступ.
ДЕВЕРЬ,м. брат мужа; дзевер.
ДЕВИЗ,м. кароткі выслоў; мянокліч.
ДЕВЯТЬ,"ліч. дзевяць, дзявяты, дзявяцера, дзевяцерны, дзявятка, дзявятнік, дзявятня, дзявяціць."
ДЕВЯНОСТО,дзевяцьдзесят.
ДЕГОТЬ,"м. дзёгаць, дзягцёвы, дзягціць, дзягцяваць, дзегцярны, дзягцяр, дзягцярніца."
ДЕЖУРИТЬ,"франц. займаць чарод, адбываць падзённую чарадоўку; чародаваць, чароднік, чарадоўшчык."
ДЕЗЕРТИР,"м. франц. зьбег, зьбежнік, зьбежніцкі, зьбегчык; уцякач, уцякачоўскі, уцякаць,"
ДЕИЗМ,"м. навука якая прызнае адзінага Бога; дэізм, аднабожніцтва, аднабожнік."
ДЕКАБРЬ,дванадцаты месяць году; сьнежань.
ДЕКАН,"м. прафэсар, старшыня факультэту; дзекан."
ДЕКЛАМИРОВАТЬ,лац. гаварыць або чытаць з
ДЕКЛАРАЦИЯ,"ж. лац. павядомленьне, апавешччаньне чаго з аканчальным вывадам; дэклярація."
ДЕКОКТ,"м, лац. навар па якім колечы, зельлі; адвар."
ДЕКОЛЬТЕ,"франц. жаночая вопратка з аткрытай шыяй і часьцю грудзей; выстрыг, растармаха."
ДЕКОРАЦИЯ,"ж. лац. аздобы, акружаньне; у тэатры палотны размяляваныя ў дрэвы, краявіды і інш; дэкорація."
ДЕКРЕТ,"м, франц. пастанова, загад."
ДЕКА,ж. ням. у музычных інструмантах даска на якой нацягнуты струны; паліца.
ДЕЛЕГАЦИЯ,ж. франц. выбарныя пасланцы;
ДЕЛИКАТНЫЙ,"франц. кволы, крохкі, мяккі; далікатны."
ДЕЛЬТА,ж. грэцк. трыкутнік ракі пры сутоцы з морам; дэльта.
ДЕМАГОГИЯ,"ж. грэцк. дамаганьнеся ўлады народу; народніцтва; спосаб вясьці спрэчку, палітыку не перабіраючы ў аргумантах, спосабах; крутацтва."
ДЕМАРКАЦИЯ,ж. франц. размяжоўка.
ДЕМАСКИРОВАТЬ,франц. разкрываць.
ДЕМОКРАТИЯ,"ж, грэцк. народніцтва, народаўладнасьць, народаўладзтва, дэмокрація."
ДЕМОНСТРАЦИЯ,ж. лац. тлумачаньне чаго з
ДЕМОН,"м. грэцк. дэман, бес."
ДЕНДИ,м. англ. модны франт; франт.
ДЕНЕЖКА,"ж. грош, шэляг."
ДЕНЬГИ,"ж. мн. гатоўка, усякая хадзячая манэта; грошы, грашавы, грашавік."
ДЕПАРТАМЕНТ,м. франц. часьць або аддзел
ДЕПЕША,ж. франц. урадовае павядомленьне
ДЕПЛОИРОВАТЬ,войска разкінуць густы шыхт
ДЕПО,"ср. нескл. франц. мейсца да зьбіраньня, скаданья і перахову якіх колечы рэчаў; склад, схоў."
ДЕПУТАТ,"м. фран. выбраны, ад ураду або ад"
ДЕРБИТЬ,"сьвярбець, кучыць, рымсьціць,"
"ДЕРГАТЬ, ДЕРГИВАТЬ","пацягаць урыўкамі; торгаць, турзаць, скубаць. Адзін штоўхае, другі моргае. Наскубі сена. Рыба скубе і паплавок моргае. Сабака турзае за полы. Турзануў за бараду."
ДЕРГОТА,"ж. сутаргі, торганьне, торгаўка, потарга, хвароба пры якой, якую келечы часьць цела безупынна торгае."
ДЕРГУНЧИК,"м. цацка, папяровая лялька ў якой ўсе чэлясы пушчаюцца ў рух пры помачы пацяганьня ніткай; гайдук."
ДЕРГАЛКА,ж. драўляны ці жалезны крук якім
ДЕРЕВНЯ,"ж. сялянская аселасьць зложаная з многіх сяліб, гаспадарак; вёска, вясковец, вясковы, вяскоўшчына, веські. Мы людзі веськія (Новагр. п.)."
ДЕРЕВО,"ср. агульн. слав. дрэва, дрэўляны, дрэўлясты, дрэўка, дравіна, драўляністы, дравянець, драўлянка, драўлянік, зроблены з дрэва."
ДЕРЕВЯНОЕ МАСЛО,аліва.
ДЕРЕТЬ,"што, дзёрці, дзярматаць, дзёрсткі, дросткі."
ДЕРЖАТЬ,"што, узяўшы не выпускаць, сьціскаць у руках, не выпускаць; дзяржаць, дзяржыцца, дзяржаньне, дзержні, дзяржак; трымаць, трымацца, трыманьне."
ДЕРЗНУТЬ,"адважвацца, пасягаць, мець адвагу,"
ДЕРЗКИЙ,"настырлівы, настырчыва, настырайца, настырчывасьць. Не настырайся, чаго настырыўся?! Настырыўся, як кот супроць сабакі. Нахраплівы, нахраплівасьць, нахрапам. Нахрапам улез у хату. Нахраплівасьць яго меры ня мае ні ў паступках, ні ў словах. Нахрытны, нахрытнасьць, нахрыцьцю (Вітабшч.); зухвалы."
ДЕРЗНОВЕНИЕ,"ср. нахрыць, нахраплівасьць."
ДЕРЗОСЛОВИЕ,"ср. аскірзаньне, грубіянства."
ДЕРТЬ,"ж. луска, астаткі ад абдзіраньня крупячных, аўсяных, грычаных; ашакі."
ДЕРЮГА,"ж. самая грубая тканіна з атрэпьпя; радно, радніна; зрэбніна, зрэбішча, каструбіна, каструбьбё; рубаўё, рубьбё. Каструбіну ткуць з атропкаў лёну; зрэбьбя з першых агрэбкаў на зрабло; радно тое-ж зрэбьбя але тканае рэдка; рубаўё, рубьбё кождая зрэбная або пакульная тканіна."
ДЕРМО,"ср. усялякіе адпадкі, непатрэбшчына; друхло, друхлядзь."
ДЕРНУТЬ,"скубнуць, торгнуць, турзнуць."
ДЕРН,"м. верхні слой глебы густа паросшы; дірван, дзірванець, дзірваны; дзярвець, цьвярдзець чарсцьвець, станавіцца, падобным да дрэва."
ДЕСАНТ,м. фр. нескл. войска прывезенае на вадаплавах і высеўшае на бераг; высадка.
ДЕСЕРТ,"м. франц. апошняя салодкая страва,"
ДЕСКАТЬ,маўляў.
ДЕСМОЛОГИЯ,"м. грэцк, часьць анатоміі, навука аб жылах і зьвязках суставаў цела; жылаведаньне."
ДЕСНА,"ж. мясістая павалока каля споду зубоў; дзёслы, дзясло."
ДЕСНАЯ,"ж. правая, правіца."
ДЕСПОТИЗМ,"м. грэцк. самаволя ўлады; самаўладзтва, дэспотызм."
ДЕСТЬ,"ж. мера або лік паперы, 24 аркушы;"
ДЕСЯТЬ,"ліч. дзесяць, дзесяціць, дзясяты, дзясятак, дзясяцера, дзясятая, дзясяціць, дзесяцькротна, дзясятны, дзясятка, дзясятчык, дзясятчына, дзясятуха, дзясятаваць."
ДЕТАЛЬ,ж. франц. часьці ці драбніцы пры мастацкай апрацоўцы цэлага: драбніца.
ДЕФЕКЦИЯ,"ж. лац. пашкоджаньне, надпсаваньне, панішчаньне."
ДЕФИЛИРОВАТЬ,"франц. прахадзіць цэраманіяльным ходам; дэфіляваць, крочыць."
