Headword,Definition
КОРЬ,ж. дзіцячая пошастная хвароба; водра.
КОРЮШКА,"рыба, уклейка."
КОРАВЕТЬ,"скарузнуць, скарузлы; кірпцець."
КОСА,"ж. доўгая пяскаватая мяліна, мельстынь; прылада да кашэньня травы, каса; суплёт жаночых валасоў, каса, коска касіца."
КОСАРИ,"мн. м. касьбіты, касьцы."
КОСОТОЧКА,"ж. брусок на палцы; трапло. Траплом трэплюць косы, востраць."
КОСВЕННЫЙ,"сукосны, скосны; субочны."
КОСМА,"ж. клак поўсьці; вахлак, вахлаты."
КОСМЕТИЧЕСКИЙ,ж. фр. які датыча умецтва і
КОСМОС,м. грэцк. сусьвет. Памылкова некаторыя ужываюць сусьвет у значэньні „всемирный“ да гэтага служыць анднаслоў — ўсесьвет.
КОСМОГОНИЯ,ж. грэцк. навука аб вытварэньні сусьвету.
КОСМОГРАФИЯ,"ж. грэцк. апісаньне ўсесьвету, ўсіх сьветаў."
КОСМОЛОГИЯ,ж. грэцк. навука аб законах кіруючых ва ўсесьвеце.
КОСМОПОЛИТИЗМ,"ўсесьветніцтва, ўсесьветнік, чалавек які не прызнае бацькаўшчыны, які лічыць сябе грамадзянінам ўсяго сьвету."
КОСНИТЬ,"марудзіць, маруда, маруджаньне, марудлівы."
КОСНЕТЬ,"быць у адным і тым самым стане; мадзець, касьцявець."
КОСНОЯЗЫЧНЫЙ,"заіклівы, картавы."
КОСНУТЬСЯ,"ткнуцца, торкнуцца, даткнуцца."
КОСОЙ,"косы, касіць, касаваты."
КОСОГЛАЗЫЙ,"касавокі, зызаваты, касавуры."
КОСОЛАПЫЙ,"крывалапы, клышавы."
КОСТЕЛ,"м. каталіцкая сьвятыня; касьцёл, касьцельны, касьцельнік."
КОСТЕНЕТЬ,"касьцявець. Аб руках кажуць: рукі скрэплі, акрэплі ад сьцюжы."
КОСТЕР,"м. дровы зложаныя ў клетку; груд. Паліць груды, расчышчаць лядо спаляньнем на грудох сучча і карчэўя."
КОСТРЮЛЯ,ж. рондаль.
КОСТЫЛЬ,"м. кавяла, кавяліць; кавіляць, хадзіць папіраючыся кавёламі."
КОСТЬ,"ж. агульн. слав., косьць, косьці, касьцявы, касьцісты, касьціна, костка, костачка, касьцяны, каставаты, касьцянка, касьцявець, кастырэць, кастыр. Лакцявая косьць — жбіца."
КОСТЮМ,"м. фр. вопратка; камплект вопраткі; асобная тэатральная, маскарадная вопратка касьцюм."
КОСЯЩАТЫЙ,касодзісты.
КОТЕЛ,"м. кацёл, кацялок, кацельны, катляр."
КОТЛОВИНА,"ж. катліна, волміна."
КОТЛЕТА,ж. фр. выбітае і пражанае блінцом
"КОТОМА, КОТОМКА","ж. дарожная торба, пляцёнка; зазвычай пляцецца з лык або бяросты і носіцца за плячмі; хатолка, тайстра, кабза, кашолка."
КОТОРЫЙ,"заімак, каторы, каторае, каторая. Каторы чалавек добры, а каторы і благі. Каторая гэта баба. Каторае у цябе дзяцё."
КОТ,"м. самец кошкі; кот, каток. Кату даюць эпітэты: мурчак, катовіч."
КАУРИЙ,"масьць, буланы."
КОФЕ,"ср. кава, кавовы, кавярня, каўнік."
КОЧАН,"м. качан, качанок; качарыжка, ножка"
КОЧЕВАТЬ,"жыць не асела, не на адным мейсцы;"
КОЧЕВРАЖИТЬСЯ,"настырацца, настырлівы."
КОЧЕГАР,"м. англ. качагар, качаргар, дравасмал."
КОЧЕНЕТЬ,"калець, акалелы."
КОЧЕРГА,ж. прылада да мяшаньня жару; качарга; кацюба; пожах.
КОЧЕТ,м. певень.
КОЧКА,"ж. курган, купіна."
КОШЕНИЛЬ,"ж. фарба; чарвец, кармазын."
КОШЕРНЫЙ,жыд. чысты.
КОШКА,"ж. самка ката; кошка, кошачка."
КОШЕЛЁК,"м. торбачка скураная на грошы; кеса, кеска; гамалейка, магалейка, кабза. „…і паказаў магалейку з чырвонцамі“ (Сержп. стр. 51)."
КОШМАР,"м. сонны прывід, душаньне ў сьне;"
КОЩУНСТВО,"насьмяханьне над сьвятымі рэчамі, заплюгаўленьне сьвятасьці; кашчуйства, кашчуйнік, кашчуйны, касьціць."
КОЭФИЦИЭНТ,м. мат. лічба на якую множыцца
КРАБ,м. круглы морскі рак.
КРАЕВОЙ,краёвы.
КРАЖА,"ж. крадзежа, крадзьба, покрадзь. Сягоньня у нас покрадзь здарылася: укралі барана."
КРАЙ,"м. ракі, мора — бераг, наўзьбярэжжа; зямля, старана і народ; край, краіна, краёвы, краёвец; пачатак і канец чаго — бераг; руб, скрай, скрайны, наўскрай; акрай, акрайны; акраец абрэзак хлеба; ускрай, ускрайны, украйны; край тканіны — пруг, а калі абшыты, абкіданы ніткай руб, рубец."
КРАЙНЕ,"прысл. скрайна, лішне, канечна."
КРАЙНОСТЬ,"ж. скрайнасьць, канечнасьць."
КРАЮХА,"ж. абрэзак хлеба ці чаго іншага; акраец, акрайчык, акройчык."
КРАЕГРАННЫЙ,"наўскрайны, скрайны."
КРАЕСТИШИЕ,ср. гранаверш.
КРАМОЛА,"ж. бунт, рокаш, ракошны, ракошнік; замутня, мутар, муціць; нерадзіца; зрада."
КРАМПОВАТЬ,"ням. аб сукне; надаваць яму полыск; грымпляваць, грымплёўка, грымпаль."
КРАНИОЛОГИЯ,"ж. грэцк. навука аб будове чэрапа, галавы; канелёгія."
КРАНЦ,"м. ням. зьвітыя ў падушку старыя вяроўкі якія зьвешываюць паўскрай вадаплава каб ён не ўдараўся голым бокам; пехтыр, пехтыры."
КРАН,"м. ням. трубка з папярэчнай затычкай да спусканьня цекляцяў; крант, кранец, кранцік. Крант у самавары заскаруз."
КРАН,"ПОД’ЕМНЫЙ, асьвер, асьверыць, сьверыць, сьвіран."
КРАПИВА,ж. расьціна Urtica; крапіва. Крапіва бывае простая і жыгучка.
КРАПЧАТЫЙ,"пярэсты, пярэсьціць. Аб масьці курэй кажуць: канаплястая курыца."
КРАСОТА,"ж. прыгожасьць, прыгожы-жая, прыгожства, прыгажэць, прыгажун, прыгажуля, прыгажуха, прыгожліва, прыгожлівасьць;"
КРАСИТЬ,"што, пакрываць фарбай; фарбаваць, маляваць. Фарбуюць фарбай разьведзенай у вадзе, малуюць фарбай разьведзенай ў пакосьце, намазуючы фарбу памазком ці квачам."
КРАСИЛЬЩИК,"м. фарбяр, фарбярства, фарбаваць, фарба; маляваць, маляваньне, маляр, малярства, малявіла. Купі фарбы на малявіла. Маляр заўсёды папэцканы малявілам."
КРАСНЫЙ,"па колеру, чырвоны, чырванець чырванявы."
КРАСКА,"ж. барвісты парашок, соль ці зельле; фарба, фарбаваць, афарбоўка."
КРАСНОРЕЧИЕ,ср. красамоўства.
КРАСНЕТЬ,"чырванець, пунсавець, спалынаць. Увесь спалынуў з сораму."
КРАСОЧНЫЙ,"барвісты, барвістасць; малёўны, маляўнічы. Малёўные аколіцы. Барвістая малятура. Ён апавядае барвіста і красамоўна. Барвісты высказ."
КРАСТЬ,"што, красьць, красцца, крадзежа, крадзьба, покрадзь, крадун, крадзец, крадзьмак, крадком, покрадкі, скрадацца, крадзьма."
КРАТА,"ж. раз, крота. Сколькі крот разоў я казаў табе. Трыкротна большы. Стокрот няпраўда."
КРАТЕР,"м. рыгво, горла агнепыхлівай гары; рыгво."
КРАТКИЙ,"кароткі, каротлівы, карацець, караціць, сукарот."
КРАТКОВРЕМЕННЫЙ,малачасны.
КРАТКОСРОЧНЫЙ,кароткатэрміновы.
КРАХМАЛ,"м. чыста мучыстая часьць зярнят,"
КРАЮХА,"ж. абрэзак хлеба; акраец, акрайчык."
КРЕАТУРА,"ж. лац. стварэньне, жывёла; дакорліва аб нечыіх дабрахотліўцах; навушнік, завушнік, завушлівец."
КРЕДИТ,"м. фр. павер, наверны."
КРЕДИТИВНЫЙ,"паверчы, паверчая грамата паслом; купецкі вексаль (беляг) на атрыманьне грошы — спаверка."
КРЕМЕНЬ,м. самы цьвёрды з паміж камянёў;
КРЕМЛЬ,"м. унутраная часьць замку, гроду; стар. дзяцінец, крамянец (ад крамень ці укромны?)."
КРЕМОТАРТАР,м. лац. вінны камень.
КРЕМ,"м. фр. страва з выбітай сьмятанькі; пуш, пушовы."
КРЕНГЕЛЬ,"м. ням. печыва з цеста; рагуль, рагулькі, рагулёк."
КРЕНЗЕЛЬ,м. дзікі адамант да рэзаньня шкла; дыямант.
КРЕНИТЬ,"вадаплаў, кланіць на бок; кланіць, клоніцца, наклон."
КРЕНЬ,"падысподны брус пад вадаплавам; полаз, каспыль."
КРЕОЗОТ,"м. лац. матэрыя якая пры згараньні маецца ў дыме і дзёгцю, заховуе мяса ад гніцьця, з гэтай прычыны дымлёная мяса не псуецца; крэазот."
КРЕП,фр. маршчыстая ценкая шаўковая тканіна; дымка.
КРЕПОН,"густая, тоўстая дымка."
КРЕСАЛО,"ж. крэсіва, служыць да высяканьня агня са скалкі."
КРЕСЛО,ср. просты услон з поручамі; крэсла.
КРЕСТ,"м. крыж, крыжы, крыжовы, крыжавік, крыжавіна. Крыжы, масьць у картах, рас. „крести“."
КРЕСТЕЦ,"м. задняя часьць паясьніцы; крыжавіна, крыж."
КРЕСТЦЫ,"м. мн. раздарожжа, розстань; крыжавыя, дарогі."
КРЕСТИТЬ,"ксціць, ксціны, кшчоны."
КРЕСТИЛЬНИЦА,ж. ксцільніца; „Ту-же и крстильница водна“ (Срезн.). Купель.
КРЕСТИТЕЛЬ,"м. ксціцель, архаічн. купала (babtista). А миръ от Покрова Бцѣ до Иваня дне до Купалъ (грам. 1349 г.)… во вторникъ передъ Купалы сьвятого Ивана, мѣсяца іюня 20 дня (Грам. Вітаўта 1396 г.). Отъ дней Ивана крстителя царстъвіе небесное нудиться (Срезн.)."
КРЕСТНИК,"м. кшчоннік, хросьнік."
КРЕЩЕНИЕ,"ср. кшчэньне. На Кшчэньне, пасьля Калядаў; кшчоны, кшчонец, кшонскі; Кшчонскіе марозы (Пагост, Дзіс. пав.); ксціны, быў на ксьцінах,"
КРЕСТЬЯНИН,"селянін, сялянскі, сяляк."
КРЕСТОНОСЕЦ,м. манах гэтага ордэну; крыжак.
КРЕЧЕТ,"м. птах, крагуй, крагуль, крагулёк."
КРИВОЙ,"крывы, крываваты, крывасьць, крывіна, крывізна, крывуля, крывуліна, крывулькі, крывіцца, крывеліцца, крывульнік, крывіць, крывень, крывець, крыўляцца, крыўляк-лячка, крыўляка."
КРИЗИС,"м. лац. пералом, пераварот. Пералом хваробы. Пераварот дзяржаўны."
КРИНКА,"ж. гаршчэчак да малака; гарлач, гарлачок; стаўбун, стаўбунец, стаўбунок; гладышка, гладышок, гэтае апошняе літаральна адпавядае рас. „кринка“; кухаль."
КРИНОЛИН,м. фр. крынуліна.
КРИН,м. расц. лілея.
КРИСТАЛ,"м. лац. выкопнае, горскае шкло; крыштал, крышталовы, крыштальны."
КРИСТАЛИЗИРОВАТЬ,"крышталізаваць, крышталізація."
КРИТИКА,"ж. лац. крытыка, крытыкаваць, крытык; ацэна."
КРИТИЧЕСКИЙ,здольны да здаровай ацэны; крытычны.
КРИТЕРИЙ,м. лац. азнака да распазнаньня праўды; крытэрый.
КРИЧАТЬ,"крычаць, крык, крычаньне, крыклівы, крыклівасьць, крыкун, крыкса."
КРИШКА,"ж. закрыўка, покрывка, века, вечка."
КРОВАВИТЬ,"крывавіць, крывавіцца."
КРОВАТЬ,"паставец на пасьцель; ложа, ложка, ложачка; архаічн. караваць, караватка."
КРОВЕНИТЬ,крывавіць.
КРОВЛЯ,"ж. страха, дах, пакрыва, покрыўка. Страхой называюць саламянную пакрыву будынка, а дахам цісовую, кахлёвую, бляшаную; пакрыва і покрыўка адносіцца да рэчаў, не да будынкаў."
КРОВЕЛЬЩИК,м. майстар які займаецца крыцьцём; стрэшнік.
КРОВЬ,ж. цеклаць якая авяртаецца ў жывым
КРОВНЫЙ,"сваяк па крыві, сваяк, крывец, крывіч, родзіч."
КРОВОСНЫЯ СОСУДЫ,кроваходныя жылы.
КРОВООБРАЩЕНИЕ,кроваварот.
КРОВОСМЕШЕНИЕ,казіродзтва.
КРОВОПРОЛИТИЕ,кровапраліцьце.
КРОВОТЕЧА,краваток.
КРОИТЬ,"што, кроіць, кроіцца, крой, кроеньне, кравец."
КРОЛИК,"м. зьвярок Cuniculus; трус, трусок, трусік, трусы, трусцы."
"КРОМА, КРОМКА","ж. сукрой хлеба; ськіба, скібка, луста."
КРОМКА,"ж. крой, сукрой; пруг, рубок, скравак, матуз."
КРОМЕ,"чаго, прысл. акром, апрыч. Акром усяго яшчэ і гэта. Акром работы яшчэ і непрыемнасьці. Акром нас з табой ніхто гэтага ня ведае."
КРОМЕШНЫЙ,"скрайны, выключны; сукротны. Цемра сукротная зн.: падысподная, пякельная."
КРОМСАТЬ,"дзёрстаць, чыркаць, чыкрыжыць."
КРОНА,ж. ням. каруна.
КРОПАТЬ,"што, рабіць памалу і няўмела, пыкаць, карпаць, кешкаць, пэцкаць, партоліць."
КРОПОТЛИВО,"пыкліва, карпліва."
КРОПИТЬ,"што чым, крапіць, акрапляць, кропіць, крапаць, крапіла, крапільніца, кропля, крапля."
КРОПКИЙ,крохкі. Крохкая зялеза.
КРОТКИЙ,"аб чалавеку, ціхі, скромны, цярплівы; лагодны, лагодзіць, лагодлівасьць, лагода; рахманы, рахманасьць, рахманіць, рахманлівасьць."
КРОТ,м. зьвярок Talpa europea; крот.
КРОХА,"ж. драбок, драбінка; крыха, крохатка, крыхаць, крышка; махатка; грудка."
КРОХОТНЫЙ,"дробны, маханькі, крыхатны, крыхатка."
КРОШИТЬ,"што, крышыць, крышыцца."
КРОШИЛО,паставец да крышэньня; крышыльня.
КРОШЕВО,"крышыва, крышанка."
КРУГ,"м. круг, кружок, кружочак, кругом, круглы, круглаваты, круглаты, круглавацік, кругласьць, круглянасьць, кругліць, круглець, клугляк, кругліня, кругавіна, кругавы, кругоўчына. Круг, абвод, акружнасьць, circulus. Кругомъ круг окропивъ около престола (Жыць. Ніф. XIII ст.). Отласъ турски круги серебраны. Круг нябесны. Небесному кругу верхотворче Господи (Ирмол. 1250 г.). С небесных кроуг Гаоўриилъ слетев ( Рум. м. XV ст.). Зодзіяк або зьвярынец нябесны. Круг животный (Срезн.). Круг сонечны, гадавы аварот зямлі наўкол сонца. Царк.: Сонечны круг 28 гадоў, пасьля праходу якіх ізноў паўтараецца парадак тыднёвых літар. Круг месячны, месячны аварот месіка наўкол зямлі. Царк.: Месячны круг, 19 гадоў, пасьля якіх маладзік вяртаецца на папярэднія дні году. Месячныя круга прочитал (Чэцья; Срезн.). Круг царкоўны, парадак службаў на цэлы год. Гаворачы аб людзях, кола, таварыства, кампанія."
КРУГОВРАЩЕНИЕ,"ср. кругаварот, кругаваротны."
КРУГОЗОР,м. сьветагляд.
КРУГОВОЙ,наўкольны. Наўкольная парука.
КРУЖИТЬ,рабіць круг; Зямля кружыць голуб
КРУЖЕВО,"рубкаваная (плеценая кручком з нітак) узорыстая стужка; карунка, фарбота фарботка, анталяжа. Анталяжамі называюць белыя, ценкія пляцёнкі, якія служаць да абшываньня бялізны, чапцоў і інш. Карункамі і фарботамі, — пляцёнкі служачыя да аздобы вопраткі, прычым фарботы рожняцца ад карунак колёровымі ўзорамі або аздобамі з камянёў і бліскучак ды махрыстым брыжом. Прыкладам, росшыўка у наўлечцы карунковая, але посьцілка якая абшыта карункой з кутасікамі будзе ўжо фарботная, — фарбота."
КРУЖКА,"ж. кубак, конаўка."
КРУМЗА,ж. зялезны крук які злучае штэмпаль („поршень“) з цягой; кавяла.
КРУЖИТЬ,"кружыць, каламесіць."
КРУПА,"ж. крупы, крупіна, крупінка; крупіць, крупнік, крупеня, страва з круп."
КРУПЧАТЫЙ,"крупаваты; крупаватка, мука буйна молатая."
КРУПНЫЙ,"буйны, буйнець, буйніна, буйнаваты."
КРУП,м. лек. дзіцячая хвароба; круп.
КРУТИТЬ,"што, круціць, вярцець. Аб нітках — сучыць. Аб вяроўках — віць. Круціць галавой, духамі. Круціць машыну, корбу, дзірку сьвярлом. Верціць вецер пыл па вуліцы. Верціць у руках мыла. Круці-вярці, а трэба памярці. Ен хоча скруціць пазычаныя ў мяне грошы. Круцель, тое што зьверчана, скручана з чагосьці і тое, што „скручана“, неаддадзена. Крынджы, крынджолы, рэчы гнутыя, кручаныя."
КРУТОЙ,"крэпка зьвіты, зсучаны; тугі, сукраты. Туга зьвітая вяроўка. Пасукраныя ніткі, — перасучаныя. Густы, ня рэдкі: густы; аб яйках — на цьвёрда, цьвёрда, не наўзьмяч; аб цесьце — тугое. Туга замешаны хлеб. Не пахоны, не палогі — прытны, стромкі. Стромкі, прыткі бераг ракі. Прытная сустромная гара. Гарачы, гарачага характару, ўдачы — прыткі."
"КРУТИЗНА, КРУТЬ","прыць, прытнасьць, прытны; сустромы, сустромны, стромкі."
КРУЧИНА,"ж. маркота, маркотнасьць, маркотны, маркоціцца. Маркота сэрца гложа."
КРУШЕНИЕ,"ср. скрушня, скрушыць. Скрушыліся ўсе мае надзеі. Скруша сталася: разьбіліся ганкі. Скруша ўсей справе."
КРЫЖОВНИК,"расьціна і ягада; агрэст, агрэсьнік, агрэставы."
КРЫЛО,"ср. крыло, скрыло, крыльлі скрыльлі, скрылатка; скрыль, крыло пчалінай вузы; крыльцы, скрыльцы. Больш згодна з духам нашай мовы і больш маючае апраўданьне ў старой літэратуры форма скрыло, нячым крыло."
КРЫЛЬЦО КРЫЛЕЧКО,"ср. прысенак, прысенцы; ганак. Ганак, слова запазычанае з польскага, а палякі яго запазычылі ў немцаў. Народнае наша: прысенак, слова вельмі прыгожае і дамэтнае."
КРЫЛЕТЬ,"расьціць лёткі, крыльлі; падрастаць; крыяць, акрыяць. Лягчэй будзе калі ўжо дзеці акрыяюць. Акрыяў надзеяй. Курчаты ужо крыяюць."
КРЫЛОРУКИЯ,"жывелы, крыланы. Да крыланоў належаць кажаны."
КРЫСА,"ж. зьвярок пац, пацук, пацукі, пацучыны."
КРЫТЬ,"што, крыць, крыцца."
КРЫША,"ж. страха, дах, строп. Строп нябесны."
КРЕПКИЙ,"агульн. слав. крэпкі, крэпка, крапчэй, крэпасьць, крапіць, крапіцца, крэпнуць; моцны, мацнець, мацаваць, мацунак, мацар, мацней."
КРЕПОСТНОЙ,"прыгонны, прыгоннік, прыгоншчына."
КРЕПИТЕЛЬНЫЙ,"змацоўны, змацняючы."
КРЮК,"м. крук, крукі, крукаваты, кручкаваты, кручнік; гак."
КРЯЖ,"цьвёрдая асобная часьць чаго, якая сама"
КРЯКАТЬ,"каркаць, гаргаць, гракаць."
КРЯК,"м. жабяя ікра; кракавіны, кракацьцё."
КРЯЧИТЬ,"кярэчыць, кярэчыцца."
КРЯХТЕТЬ,"крактаць, крэнкаць."
